{
  "WebScience.SurveyId": "f85b22d6-b0a6-419f-820a-75f28c1a8af3",
  "WebScience.Measurements.PageNavigation": {
    "numUntrackedVisits": 500,
    "trackedVisitsByDomain": [
      {
        "domain": "nytimes.com",
        "numSessions": 3,
        "visitsByReferrer": [
          {
            "referrerDomain": "google.com",
            "dayOfWeek": 1,
            "timeOfDay": 8,
            "pageCategory": 1,
            "numVisits": 10,
            "totalAttention": 500,
            "totalScroll": 400,
            "prevExposedCount": 3,
            "laterSharedCount": 1
          }
        ]
      }
    ]
  },

  "WebScience.Measurements.SocialMediaLinkSharing": {
    "linkSharesByPlatform": [
      {
        "platform": "facebook",
        "numUntrackedShares": 30,
        "trackedShares": [
          {
            "domain": "nytimes.com",
            "pageClassification": 0,
            "audience": "public",
            "source": "page",
            "visitReferrer": "google.com",
            "prevExposed": 1,
            "numShares": 5,
            "dayOfWeek": 2,
            "timeOfDay": 20
          },
          {
            "domain": "nytimes.com",
            "pageClassification": 1,
            "audience": "restricted",
            "source": "",
            "visitReferrer": "google.com",
            "prevExposed": 1,
            "numShares": 3,
            "dayOfWeek": 2,
            "timeOfDay": 20
          }
        ]
      },
      {
        "platform": "twitter",
        "numUntrackedShares": 10,
        "trackedShares": [
          {
            "domain": "nytimes.com",
            "pageClassification": 2,
            "visitReferrer": "google.com",
            "audience": "public",
            "source": "",
            "prevExposed": 0,
            "numShares": 2,
            "dayOfWeek": 2,
            "timeOfDay": 20
          }
        ]
      }
    ]
  },

  "WebScience.Measurements.LinkExposure": {
    "untrackedLinkExposures": {
      "1000": 10,
      "3000": 4,
      "5000": 4,
      "10000": 2
    },
    "linkExposures": [
      {
        "sourceDomain": "google.com",
        "destinationDomain": "nytimes.com",
        "dayOfWeek": 1,
        "timeOfDay": 4,
        "visThreshold": 3000,
        "numExposures": 10,
        "laterSharedCount": 3,
        "laterVisitedCount": 4
      },
      {
        "sourceDomain": "google.com",
        "destinationDomain": "nytimes.com",
        "dayOfWeek": 2,
        "timeOfDay": 8,
        "visThreshold": 1000,
        "numExposures": 3,
        "laterSharedCount": 3,
        "laterVisitedCount": 4
      }
    ]
  }
}
